Dallas1,32.779555,-96.8009703,"208 S Akard Street, Ste 110, Dallas, TX 75202",Mon Dec 17 18:47:40 +0000 2015," This is the most terrible service provider I've ever dealt with. Not only do the representatives never visit your home to do the check they are supposed to for home service, then when you go to cancel before even having service hooked up they transfer you to multiple depts (most out of country) and eventually you speak to someone who says they have canceled you but then I received a disconnect notice weeks later stating I had never paid for my service. That's because I disconnected the service before it ever was connected!!! I thought the whole thing had been resolved because ATT had never contacted me before sending this strange disconnect notice. I am starting to think the whole thing is a scam and ATT is not real. I have talked to so many different dept and all they can say is that my service is connected, but I have no dial tone. They say it is the fault of the house wiring. They never checked the exterior of the home to make sure it was connected. At this point I am writing a formal complaint to ATT and will also be contacting the BBB and The California Service Utilities Commission. There is something very wrong with this company and I would hate for anyone else to have to deal with these same issues. This was for home phone service. ",Negative,100.0000,1,Google
Dallas1,32.779555,-96.8009703,"208 S Akard Street, Ste 110, Dallas, TX 75202",Mon Dec 17 14:05:52 +0000 2015, Keep having problem with unlocking the device even after paying a high amount of termination fee. AT&T is one of the biggest joke of US companies (the other one being Comcast).  ,Negative,78.3669,1,Google
Dallas1,32.779555,-96.8009703,"208 S Akard Street, Ste 110, Dallas, TX 75202",Mon Dec 17 13:44:31 +0000 2015," AT&T U-verse is a bureaucratic nightmare, they are deceitful and cheat customers.  Stay with Comcast, Cox Communications or other cable TV providers.  Search web for ""AT&T bureaucratic nightmare, is deceitful and cheats customers"" ",Positive,92.6517,1,Google
Dallas1,32.779555,-96.8009703,"208 S Akard Street, Ste 110, Dallas, TX 75202",Sun Dec 16 23:37:12 +0000 2015," Customer Service is seriously flawed.  Subscribed to U-verse and Internet services in mid-2013 and had nothing but problems for nearly a year.  We filed complaints with the Federal Trade Commission and state's attorney general in 2013.  Cancelled both services in May 2014 and returned receiver and remote a few days later.  Now, AT&T threatening via letter and say we will be liable for attorney fees.  I spoke with 2 customer service people in May and June, Ms. Davis in Illinois and Mr. Chris in California explaining we do not owe anything and AT&T even sent us a credit check for the refund.  In July, AT&T has debt collectors calling day and night.  We now have Cox and working with state Atty General Office. ",Positive,70.0262,,Google
Dallas1,32.779555,-96.8009703,"208 S Akard Street, Ste 110, Dallas, TX 75202",Sun Dec 16 21:00:42 +0000 2015," The plaza out front is open to the public, but not according to the rent a cop who is subcontracted from Allied Barton Security, by the name of Ernesto Garcia.  I have seen people walk their dogs, stop with baby carriages, kids from the Pegasus Charter School hang out there, he doesnt say a damn thing, but when I was there talking on the phone with someone asking for directions from where I was, and just drinking a soda, Ernesto told me that only AT&T employees are allowed there.  That is bull, there is no sign ANYWHERE that says it is a private plaza.  I told Ernesto to go screw himself, I will admit that, and told him that this was a public plaza.  Ernesto thinks he is Dallas PD and is a wannabe cop, he needs to be fired actually.  This is why people hate AT&T, not only are they bullies to other companies and have terrible customer service and screw customers over, they dont want people in their plaza even though its public.  I see 40 employees all the time outside there smoking, shows you something as well, that they are on their smoke breaks more than helping customers and running people off who are minding their own business.  I think Ernesto needs to be fired, cause if he dares say that to me again, i am filing a malicious prosecution lawsuit on him and AT&T ",Positive,69.8758,1,Google
Dallas1,32.779555,-96.8009703,"208 S Akard Street, Ste 110, Dallas, TX 75202",Tue Dec 11 23:04:06 +0000 2015," I really wish I had never in my life gotten service with AT&T. This company has destroyed my credit from a 764 to a 600. Never got a single bill and sent me to collections twice. I move around a lot so they open an account for each address and never update to the new address (I was not told there would be multiple accounts). Called UVerse and they said I owed nothing. Called the DSL department and they could not find a balance either. Kept getting bills without a balance. Called AT&T about the collections, they said it was fraudulent and not to pay. So I didn't. Finally after 6 months of harassment, I write a letter to the finance department and they get to the bottom of it. It takes days of calls and a million transfers to finally find the accounts overdue. I pay them off immediately. They REFUND the money for one of the accounts and apologize for my trouble. A month later, I get a bill asking for the money back. If you wanted the money why didn't you just keep it?! I'm so sick and tired of wasting my time writing letters to everybody, holding on the phone, and trying to fix my credit with the bureaus. Now I'm expecting my first child and have nowhere to live because I can't lease with this terrible credit. All because of AT&T. I will never hire this company again if it was the last  in the planet. It's not worth it. I will recommend the same to all my friends and anybody who reads this. Beware!!! ",Negative,100.0000,1,Google
Dallas1,32.779555,-96.8009703,"208 S Akard Street, Ste 110, Dallas, TX 75202",Tue Dec 11 23:03:34 +0000 2015," I thought I had bad service with AT&T in the past, but lately has been worse than anything I could've imagined.  I was moving about a mile away from my previous apartment.  I called and scheduled a transfer to the new place for the first day I was to move in.  I was informed my modem wouldn't work at the new place and I would be required to rent one, I'm not happy about this, but I had other things to worry about with the move.

So the technician shows up and informs me that he needs to wait on another technician before he can start.  Long story short, the other guy never showed up.  He advised me  to just schedule for another day.  I do this, but they can't come out for another week.  Next week, a technician shows up, he says he can start but can't complete the job until another technician shows up.  We wait 5 hours and another no show.  He says the other guy just needs to do something outside and is scheduled to come by and I'll be notified when it's done.

Then it gets really bad, I start getting voicemails everyday asking me to call in and schedule an installation.  When I return the call I'm advised I don't need to schedule an installation, just keep waiting and a technician should be out within a few days to complete.  Everyday I get voicemails.  It always goes to voicemail because the iphone 5 AT&T charged me out the nose for typically doesn't ring and I miss the majority of my calls.  After dozens of phone calls back and forth, now all of a sudden, they can't pull up my account when I give them my number.  This culminates with a call center experience around the world speaking with Americans, Indians, etc.  This call ends after 38 minutes when I realized the 4th time I've been transferred it's been to the wrong department.

Many, many calls later, and dealing personally with an AT&T rep who my apartment building pays to assist the residents to get service, we finally determine the number they have on file for me was altered by one digit.  I ask for this to be corrected and once again schedule a technician to come out.  Well it appears customer service has my correct number, but the technician doesn't.  So he can't contact me.  A 4th technician is scheduled to come out and I ask he's given the correct number, he is not.  He shows up and can't contact me.

I'm nearing 4 weeks since I moved, around 50 phone calls, 4 technician visits, 2 where I let them in my apartment, and still no service yet.  Meanwhile I'm racking up huge data bills on my phone, which doesn't ring when friends and family and technicians call.  I'm being told I will be forced to rent a modem (no option of buying) that has a ranking on Amazon of 2 starts and runs for about $20 to buy outright.

Also, I haven't even seen a bill in over year since I switched to paperless billing.  Now when I login, I need to synch my Uverse bill to my cellphone bill.  Guess what?  I gave up trying to get it synched after 5 calls to customer support where we reset the password and it didn't work.  I can't even review my bill to understand why I'm paying $170 per month to have a cell phone line and home internet,  NO TV!!

Nothing more to say, but complete and utter dysfunction.  I hope the executives are enjoying their experience at Cowboys stadium since they are paying Jerry Jones $19 million per year of company money for the naming rights.  Apparently this money came out of customer service since it's simply broken. ",Negative,100.0000,2,Google
Dallas1,32.779555,-96.8009703,"208 S Akard Street, Ste 110, Dallas, TX 75202",Tue Dec 11 21:28:57 +0000 2015," I've been with AT&T since 1978 and they have become the worst business I've ever seen. They haven't resolved my account balance in weeks after many promises. They even agreed, several times, my billing was incorrect. They are double billing me for Uverse WiFi and telephone service. The worst! ",Negative,99.9610,1,Google
Dallas1,32.779555,-96.8009703,"208 S Akard Street, Ste 110, Dallas, TX 75202",Tue Dec 11 21:21:52 +0000 2015, Conveniently located in downtown Dallas near my office.  Not as large a space as most other AT&T stores but they have a good selection of phones.  What I don't like here is that I am rarely asked if I have been helped. I always have to find someone to take my companies money.   ,Negative,98.9824,2,Google
Dallas1,32.779555,-96.8009703,"208 S Akard Street, Ste 110, Dallas, TX 75202",Tue Dec 11 03:46:09 +0000 2015," Whatever you do, don't use AT&T for ANYTHING! They lie to you! We had a service outage on a Friday, we called and got an appointment for Monday am 8-12. Today is Wednesday night and it is still not fixed. We hear the same story every time, ""you are on the schedule for tomorrow morning as a priority"". We have been on the schedule for DAYS as a priority and they still can't fix our outage? NOT ACCEPTABLE. Save yourself the trouble and go with anyone other than AT&T. ",Negative,99.9598,1,Google
Dallas1,32.779555,-96.8009703,"208 S Akard Street, Ste 110, Dallas, TX 75202",Tue Dec 18 21:48:42 +0000 2015," Having a horrible time with U-Verse since it was installed.  Bandwidth issues cause my TV video to lock up or DVR to stop on occasion (usually when downloading on tablet or laptop also on wireless).  

Also, my DVR completely died tonight, taking about 12 pre-recorded movies (from HBO when I had it) with it.  Now, keep in mind that I pay about $135/month for internet and tv service.  Yes.. expensive.   So, I have high expectations around service.  They told me that they were going to have to send me out a new DVR and when I get the old one, I have to return it to a UPS store within 10 days (or get billed for it).  Ok.. starting to get upset... How is this my fault?

Then, I tell them that I want to be reimbursed for the movies I lost.  12 movies that I have not yet watched by $6/movie, I asked for $72.  Their answer was that they would give me a $30 credit, but that is it.  Again, how is this my fault and why do I pay $135/month for this crap?!

And, more importantly, how do you stay in business providing junk and overbilling for it with horrible service?
 ",Negative,100.0000,1,Google
Dallas1,32.779555,-96.8009703,"208 S Akard Street, Ste 110, Dallas, TX 75202",Mon Dec 17 20:45:38 +0000 2015," At&amp;t has some of the worst customer service I ever experienced in a business. I won't go into too much detail but they took out an un-authorized payment and caused four over draft charges on my bank account. After setting up a case and talking to numerous representatives, supervisors, and managers, I came to the realization that every employee there is a liar and starving for your money. Even though I have the PROOF(bank statements, text messages, representatives first and last names) they still had the nerve to say this was my fault and wouldn't help me with the over draft fees. Granted they were willing to credit my account for the amount, I wanted a check sent to me to pay back the people I had to borrow money from to bring my bank account back current. This has affected my credit, and put a HUGE amount of stress on me and my family. The fact that everyone I talked to was sympathetic and then would just transfer me to another employee because they were done dealing with me is unacceptable to the max. I cannot stress the amount of problems this has caused for me. If your looking for a phone provider, I suggest going elsewhere because none of At&amp;t's employees care about their customers' well being.  ",Negative,100.0000,1,Google
Dallas1,32.779555,-96.8009703,"208 S Akard Street, Ste 110, Dallas, TX 75202",Mon Dec 17 18:47:40 +0000 2015," Absolutely the worst service I have ever had. Every time a tech comes out they move all of the equipment in my house, and the service works great for a couple of hours, then it's worse than it was before they moved everything around. Then it takes months to get anyone back out.  ",Negative,99.9769,1,Google
Dallas1,32.779555,-96.8009703,"208 S Akard Street, Ste 110, Dallas, TX 75202",Mon Dec 17 14:05:52 +0000 2015," I have switched over to AT&T recently and have had more downtime in three weeks than I have had over a 5 year period. To complicate matters, AT&T has moved implementation to India presenting me with HORRIBLE customer Service and highly inept technical group. AT&T...your service delivery and your service quality has been highly effective in reducing the bothersome customer base. I will be moving 17 Companies with multiple locations away from you and I will never recommend your service to anyone ever again. I hope your profit margin is good. ",Neutral,56.0517,1,Google
Dallas1,32.779555,-96.8009703,"208 S Akard Street, Ste 110, Dallas, TX 75202",Mon Dec 17 13:44:31 +0000 2015," Does your bill confuse you? Me too. 

Is your internet slow when you have UVERSE TV on? Mine too. 

AT&T seems to have established levels that you have to fight through as a customer. It's starts in the US, transfers to the real Battle Roya in India where the Customer Service rep defends their terms, then to the customer service rep's manager and then back to America when you're ready to cancel they give you pretty much what you were asking for originally.

It's annoying and a terrible experience. When did it become acceptable to nickel and dime your customers? Thanks cell phone companies.

If your UVERSE internet seems slow it's because when your TV is on the internet slows down. I split service providers. Works well now.

Instead of upsetting the Customer Rep in India - just do their little dance get to the manager and then tell them you want cancel your service and get to the cancellation process and see if they can resolve your issue.

OH - and make sure to review AT&T while waiting on the phone and during your discussion. Google, Bing, Yahoo, Amazon - one comment can have huge impacts. 

Thanks Google!  

 ",Negative,99.9170,1,Google
Dallas1,32.779555,-96.8009703,"208 S Akard Street, Ste 110, Dallas, TX 75202",Sun Dec 16 23:37:12 +0000 2015," Please don't faint when you hear this.  If  you go with MetroPCS, you get unlimited minutes and unlimited texting throughout the continental US for $40 per month, as long as you stay within a certain area.  I don't travel much, I have family that lives out of the area.  This is perfect!!!  Excellent customer service as well.  Never have a problem.

I dread next month.  My AT&T service is up for renewal.  I use it for the internet service.  It's been better lately, but when it starts getting a slow connection, I also get slow customer service. Last year they conned me into adding a land line onto my account to get the cost down.  I don't even use the phone.  It just sits there.  I use my MetroPCS cell phone.  I wonder what they're going to do this year.   ",Negative,99.9999,2,Google
Dallas1,32.779555,-96.8009703,"208 S Akard Street, Ste 110, Dallas, TX 75202",Sun Dec 16 21:00:42 +0000 2015," Very poor customer service.
Non working voice prompts to get help when calling the help lines.
Poor trouble shooting. After 90 minutes of troubleshoot, got modem to work. 5 minutes later, stopped working again. Called for more wasted time of troubleshooting, then a supervisor told me of modem charges and fees (and 10 days of no service during shipping), so I told them nevermind. They shipped modem anyway, and charged my bill. Credit may show up in 90 days, so in essence I am lending ATT $100 for 90 days for their mistake and their poor service. When I call, NO ONE SAYS SORRY, OR SEEMS TO CARE.  ",Negative,100.0000,1,Google
Dallas1,32.779555,-96.8009703,"208 S Akard Street, Ste 110, Dallas, TX 75202",Tue Dec 11 23:04:06 +0000 2015," This morning I spent one hour and thirty four minutes speaking with two AT&T customer service reps and two supervisors. That's one hour and thirty four minutes of my life that I'll never get back, and all I wanted to do was pay my bill. I don't believe that I have ever encountered such stupidity. The second supervisor swore that her supervisor would call me back, but that never happened. These were all Americans. I'd be better off talking with someone in India - they're smarter. ",Negative,100.0000,1,Google
Dallas1,32.779555,-96.8009703,"208 S Akard Street, Ste 110, Dallas, TX 75202",Tue Dec 11 23:03:34 +0000 2015, Ok but their nokia phone get virus easily ,Negative,88.2587,1,Google
Dallas1,32.779555,-96.8009703,"208 S Akard Street, Ste 110, Dallas, TX 75202",Tue Dec 11 21:28:57 +0000 2015, Good. ,Neutral,51.5378,1,Google
Dallas1,32.779555,-96.8009703,"208 S Akard Street, Ste 110, Dallas, TX 75202",Tue Dec 11 21:21:52 +0000 2015," I JUST TALKED TO JAY EF2497 (EMPLOYEE ID NUMBER) I CALLED THE SAN ANTONIO LISTED NUMBER AND WAS TOLD INDEED CORPORATE OFFICE IS IN DALLAS. I TOLD OPERATOR I HAD A COMPLAINT AND SHE SAID SHE WILL SEND ME TO THE ""OFFICE OF THE PRESIDENT"" I GOT THIS JAY B-HOLE WHO SAID HE WAS IN OFFICE OF THE ""PRESIDENT"" YET, ODDLY ENOUGH, HE WAS IN KANSAS CITY AND HE DID SAY CORPORATE OFFICE WAS IN DALLAS. I SAID SO ANOTHER LIE FROM AT&T. NO WAY IS THE PRESIDENT IN KC WHEN THE OFFICE IS IN DALLAS.GIVE ME A BREAK DOES AT&T THINK THEY ARE DEALING WITH A WORLD OF 3RD GRADERS? ",Positive,99.6416,1,Google
Dallas1,32.779555,-96.8009703,"208 S Akard Street, Ste 110, Dallas, TX 75202",Tue Dec 11 03:46:09 +0000 2015, Ouch! This place has bad reviews we have been at&amp;t for a lot time now service  is good.  They could be bad in Dallas but Arlington service is good  ,Negative,99.5009,1,Google
Dallas1,32.779555,-96.8009703,"208 S Akard Street, Ste 110, Dallas, TX 75202",Tue Dec 18 21:48:42 +0000 2015, AT&T Lies about cell phone service promising new lower price than charging $50 higher and saying you only option is to pay sugnificant cancellation fees ,Negative,96.5301,1,Google
Dallas1,32.779555,-96.8009703,"208 S Akard Street, Ste 110, Dallas, TX 75202",Tue Dec 11 21:21:52 +0000 2015, They cheated me out of a $200 reward card.   ,Negative,86.2908,1,Google
Dallas1,32.779555,-96.8009703,"208 S Akard Street, Ste 110, Dallas, TX 75202",Tue Dec 11 03:46:09 +0000 2015, Im alivei ,Neutral,50.0000,1,Google
Dallas1,32.779555,-96.8009703,"208 S Akard Street, Ste 110, Dallas, TX 75202",Tue Dec 18 21:48:42 +0000 2015, Great service!  ,Positive,68.7689,5,Google
Dallas1,32.779555,-96.8009703,"208 S Akard Street, Ste 110, Dallas, TX 75202",Tue Dec 18 21:48:42 +0000 2015, What these people are doing is wrong ,Negative,92.0494,1,Google
Dallas1,32.779555,-96.8009703,"208 S Akard Street, Ste 110, Dallas, TX 75202",Mon Dec 17 20:45:38 +0000 2015, Mr. T. has always been a hero of mine -- glad to see he has his own company now.  ,Positive,99.8464,1,Google
Dallas1,32.779555,-96.8009703,"208 S Akard Street, Ste 110, Dallas, TX 75202",Mon Dec 17 18:47:40 +0000 2015, WORST SERVICE EVER! WILL NO RECOMMEND TO ANYONE. PERIOD ,Neutral,58.9602,1,Google
Dallas1,32.779555,-96.8009703,"208 S Akard Street, Ste 110, Dallas, TX 75202",Mon Dec 17 14:05:52 +0000 2015," I really hate the U-verse system, customer service, and promotions. I have signed up with ATT in Juanuary of this year and i really hate it..its too expensive to start with; however i was informed that i will receive a promotion for the first six months. I have never seen anything. when i call to check, at first i have to be on hold for about 45-60 minutes, Actually I am currently on hold to speak to a manager for the past 35 minutes as i am writing this review. So, everytime they keep saying, ""you dont have a promotion"" and when i speak to a manager they usually apologize and promise that wont happen again. the following month i have to call again. I am about to really sue AT&T for my time and stress, Someone up high in this company should look into these complaints.. ....I HATE AT&T  I am going to SUE THEM FOR SURE...... I HATE THIS COMPANY... THE  promo Rethink Possible my AS* ",Negative,100.0000,1,Google
Dallas1,32.779555,-96.8009703,"208 S Akard Street, Ste 110, Dallas, TX 75202",Mon Dec 17 13:44:31 +0000 2015," The best way to descrive AT&T Wireless is by saying: STAY ALWAYS &amp; RUN.
well i;ll try to make it short: the service is fine as far as coverage, but here the deal (if your interested in getting on IPHONE) i been a very lawyer customer of AT&T since 1994 when i first took my number to date. I travel alot &amp; having no way to used that countries pre-paid service is the worse. I get 200.00 dollars bill just on the roaming charges without even making phone calls and just useing text and data. AT&T saids its not up to them to provide a IMEI unlock for iphone but thats a HUGE LIe, Infact its beacuse of them why the iphones are lock. Millions are people wouldn't go with the iphone fron the start beacuse you were force to add a $30.00 unlimited data service in top of what ever was your calling plan, but now they got rid of that expensive plan and made it more expensive but on a very sneaky way. You choice your guest data plan u like to used but the iphone always communicates online and will eat 1 to 3 gigs in weeks just on siri and visual Voice mail, etc,, What a discusting way of doing business. It really doesn't matter how loyal you are, they don't care. All they care about is getting your money and raising the prices on all beacuse of the stupidity the higher end PENCIL pushers made with the T-Mobile deal gone bad. They lost millions because they recanded in the end but now they want the customers to pay for there mistakes.. Stay alway from them, if you still want a Iphone, you still can, Buy the unlock ver, i know its expensive but at the end it will pay off in a few months of service with them. Go buy the Sprint or Verizon iphone because ones u upgrade or change the phone is worthless (garage) unless if u give to another person within the same carriar. There none GSM ver Iphone, They ONLY WORK WITH THAT CARRIAR, EXCEPT THE GSM ver phone. ",Negative,100.0000,1,Google
