Store,Latitude,Longitude,Address,CreatedAt,Text,Senti,Rating,Source
Dallas2,32.8111091,-96.8092962,3329 Oak Lawn Avenue Dallas TX 75219,12/16/2010,"Scott L. nailed it.  Unless you're lucky and go on an off hour (if they have one), it will be really busy.  They'll put your name down and get to you when they get to you.  Minus one star for the inconvenience--we've had visits that should take 5 minutes last 45.The reason for the other star deduction is that the majority of the people who work there don't know much technical info about the products they're selling, but as far as customer service goes, they are helpful and reasonable.  So far no jackasses and we've been there quite a bit buying/returning/buying again for Dr. S' most recent phone(s).",,3,Yelp
Dallas2,32.8111091,-96.8092962,3329 Oak Lawn Avenue Dallas TX 75219,11/5/2013,"Better than walking into an auto dealer fix it shop, these guys are very professional. Daniel took care of me from the time I walked in; he had to look for what wanted because it wasn't on the shelves... he even applied the screen protector for me! Seamless, effortless, and enjoyable.",,5,Yelp
Dallas2,32.8111091,-96.8092962,3329 Oak Lawn Avenue Dallas TX 75219,4/1/2013,Great service here! Much faster than other stores I've been to. Thanks!,,3,Yelp
Dallas2,32.8111091,-96.8092962,3329 Oak Lawn Avenue Dallas TX 75219,8/8/2011,"Rude, unfriendly, and a waste of time! I walked up to a clerk, got the words Me: can you... (Interrupted)AT&T Guy: excuse me sir, there is a wait!Me: I just have a question before I wait(eye roll, and deep breath for AT&T guy)AT&T Guy:  I guess I can answer itMe: I said no thanks, sorry to bother and left!",,1,Yelp
Dallas2,32.8111091,-96.8092962,3329 Oak Lawn Avenue Dallas TX 75219,7/3/2014,"My Blackberry was circling the drain, and instead of calling AT&T for what always ends up being frustrating, and I feel, a total waste of time I dropped by the Oak Lawn AT&T store to check out new phones. I walked in at 2pm, no wait, and am out the door with a Samsung S5 at 3:10pm ready to roll.  Steve Walton made what is usually a most unpleasant experience for me (hate tech changes) into 'I'm glad my BB died'! He is the most helpful and knowledgeable salesperson I've ever met working at a cell phone place. He took the time and asked questions that really helped, and saved me money on not only my new cell, but my landline and Uverse. Kudos to Steve! I'll always go back there and ask for him when I need help with my cell phone.",,5,Yelp
Dallas2,32.8111091,-96.8092962,3329 Oak Lawn Avenue Dallas TX 75219,9/12/2010,"This store is busy and you will be greeted prompty by someone to get sign up on an electronic clipboard or perhaps be trouble shooted immediately, or perhaps wait for 30 minutes.  Don't be in a hurry, and ask about specials. You should be able to find at least one person that is very helpful.",,3,Yelp
Dallas2,32.8111091,-96.8092962,3329 Oak Lawn Avenue Dallas TX 75219,12/29/2012,"I came in to buy an iPad, knew exactly what I wanted and with only 3 people on the list in front of me, was still forced to wait 30 min talk to a sales associate.  No apologies or heads up from the 'hostess' at the door.",,1,Yelp
Dallas2,32.8111091,-96.8092962,3329 Oak Lawn Avenue Dallas TX 75219,12/22/2009,"Big news everyone...I JUST GOT MY FIRST iPHONE!Yup. I'm officially a big girl now. After our dog knocked an entire glass of water on my BB, I decided it was time to upgrade. I just got back from this AT&T store and man...it was so easy!I'm still currently a Tmobile customer and walked in not knowing what to do. Thankfully Rudy was there to help me as soon as I opened the doors! He escorted me to the desk, where I gave him a couple of bits of information that he entered. Ten minutes later, he was downloading my address book and pictures from the BB to my new iPhone.Rudy showed me how to do the simple things on my new phone, a few hints and tips, and gave me his card with his personal cell phone on it in case I have any problems. He was even able to show me how much my first bill is going to be, as well as the following bills. I had no questions walking out today.The best part -- I was outta there in less than twenty minutes -- wham, bam, thank you ma'am!! (I mean, sir)",,5,Yelp
Dallas2,32.8111091,-96.8092962,3329 Oak Lawn Avenue Dallas TX 75219,11/12/2012,"I had a question about data overseas. A lady standing (guard?) at the door said with a frown, ""I'm sorry it will be 30-45 minute wait.""  Monday afternoon and I have work to do I replied, ""No thank you.""",,2,Yelp
Dallas2,32.8111091,-96.8092962,3329 Oak Lawn Avenue Dallas TX 75219,10/11/2013,AT&T is the worst company ever! I have been a customer for over 10 years and they have managed to screw me again. I made a payment arrangement and today I discover my phone is cut off. I call to talk to them and all they can tell me is I made a payment arrangement on the 9th of October for the 9th of October. WHY WOULD I DO THAT? I made the arrangement for the 21st. I advise no one to use AT&T. They wont help me even tho I have been a customer for over 10 years. And they want me to pay the reconnect fee. They obviously don't care about their customers.,,1,Yelp
Dallas2,32.8111091,-96.8092962,3329 Oak Lawn Avenue Dallas TX 75219,8/11/2013,Beware of their sales tactics. Went to have my uverse moved to a new location. The sales associate was very discouraging on a transfer and insistent on opening a new account. I ask for the manager and he was no help. Obviously they want you to set up a new account for some financial gain to them. You lose your number and there is an external credit check if you set a new account up. After 20 min of arguing with ten about transferring my account a walked out without accomplishing anything. Once again horrible service from AT&T.  I think it is time for Charter Cable and Sprint simply everything plan for my cell! Time to say goodbye to poor service from AT&T!,,1,Yelp
Dallas2,32.8111091,-96.8092962,3329 Oak Lawn Avenue Dallas TX 75219,1/30/2013,"We were in the store recently and were trying to switch a cell phone to a land line. Sounds strange, but this phone number has been in the family for over 50 years (minus the area code of course). We had a recent death in the family, so it was important we keep the number; we explained all of this to JJ, who provided the absolute best customer service. We were there for 2 hours, and while this is a long time, JJ was on his feet the whole time helping us every way he could. First AT&T wanted to charge us a cancellation fee for the cell phone, which doesn't make sense since the person passed away. He managed to go around that fee, as well as others, and we finally got the number switched. He was pleasant the whole time, making small talk with us, making us laugh and it really didn't seem like 2 hours. People like JJ are few and far between! Top notch customer service",,5,Yelp
Dallas2,32.8111091,-96.8092962,3329 Oak Lawn Avenue Dallas TX 75219,3/23/2010,"Normally I hate going to the AT&T stores (had never been to this one), so when my GF lost her iphone and suggested we go there to get her a new one, I geared up for a total a** whip. However, a guy named Fernando greeted us, took care of us, and was the most helpful, laid back, easy going guy I've ever met working at a cell phone place. My GF and I both left talking about how great he was, and what a relief it was to be taken care of by a guy who seemed to genuinely care and want to be helpful. I'll always go back here and ask for him when I need help with cell phone stuff.",,5,Yelp
Dallas2,32.8111091,-96.8092962,3329 Oak Lawn Avenue Dallas TX 75219,8/26/2011,This store is awesome! Staff is underastanding and great at problem solving. A friend recommended this store to me over a year ago and I have been coming back ever since. The service has only gotten better! The staff at this location is on it! Responsive and great problem solvers! Keep it up!!!!!!,,5,Yelp
